{
  "schema_version": "h4l-evaluation-plan-v1",
  "dataset": "atlas2020_4lep",
  "protocol_sha256": "4954e2ec4c4ef8d4b35e24e456940a5485996d607f0a0083f607cf0e2fee5955",
  "registration_status": "exploratory_posthoc",
  "inputs": {
    "prepared_artifact_id": "0000000000000000000000000000000000000000000000000000000000000000",
    "template_artifact_id": "0000000000000000000000000000000000000000000000000000000000000000",
    "freeze_artifact_id": "0000000000000000000000000000000000000000000000000000000000000000"
  },
  "mc_bootstrap": {"replicas": 200, "seed": 42001},
  "model_self": {"injections": [0, 1, 2], "toys_per_injection": 500, "seed": 42},
  "assessment": {"injections": [0, 1, 2], "toys_per_injection": 500, "seed": 42},
  "t2": {"mu": 1, "seed": 42, "outer_replicas": 20, "inner_toys": 100},
  "stress": {
    "mu": 1, "toys": 500, "seed": 42,
    "kinds": ["normalization", "mass", "score", "correlation"],
    "directions": [-1, 1], "modes": ["omitted", "modeled"]
  }
}
